{
  "$schema": "https://evolith.dev/sdlc/sdlc-phase.schema.json",
  "id": "f2",
  "name": "Design & Architecture",
  "shortName": "Architecture",
  "order": 2,
  "description": "Architecture decisions documented; bounded contexts defined; functional stories written.",
  "gates": [
    "gate-f2"
  ]
}
